### ISSUE TITLE
Venus 3.0 Local API turns off

### ISSUE THREAD

**Issue by bertsmelik** [jaapp/ha-marstek#85]
I have 2 Venus 3.0 firmware v144. Tested on one with local API and this integration and that worked well.
So I joined the second Venus 3.0 (also v144). Now the second one works for some time, and then turns off Local API by itself.  Sofar this occurs one a day.
I turn on charging with a script setting the Venus to Passive mode with power -2500, then return to Auto by a push button script.

Today I saw in the script traces the error at 13:15 (when charging should start)

> **Error: Failed to set passive mode: Device rejected passive mode configuration (power=-2500W, duration=14400s)**

I seems that after that Local API has turned off and the battery can no longer be seen by the integration.

The first Venus works without problems.
Has anybody else here seen this problem and, hopefully, knows how to fix this?

**Comment by schauveau** [comment]
Same issue for me. During the last 24h, the Local API as turned off and the CT was disconnected 3 times on my Venus E with firmware 144. 

While playing with the local api, I also noticed that a few requests fail with error -32700 Parse Error:

```json
{
	"id":	0,
	"src":	"VenusE 3.0-bc2a33601ff9",
	"error":	{
		"code":	-32700,
		"message":	"Parse error",
		"data":	403
	}
}
```

My test script always send the same `ES.GetStatus` request `{"id":11,"method":"ES.GetStatus","params":{"id":0}}` with an increasing id number so a parsing error is quite unexpected.  A short UDP request like that one can be lost but it should not be corrupted. There is definitely something wrong in their local api implementation.  

As a side note, I also noticed that after sending an empty request (0 bytes), the local api stops responding to any further requests. In the Marstek app, the Local API is still marked as enabled but turning it OFF and ON is enough to make it work again.

**Comment by schauveau** [comment]
I just noticed that most of the settings are also lost (CT, Local Api, Power 800/2500, DOD, ...),   when I turn the battery OFF and ON using the power button (about 3s).
  
The user manual does not describe the power button behavior. Is it supposed to reset the settings like that?

**Comment by bertsmelik** [comment]
Meanwhile Marstek pushed V146-111 to both which I installed. Problem still remains and I got a new problem: Venus does not discharge when running in "Auto" mode (nul op de meter). 
Marstek support advised to power down and disconnect for approx. 4 hours. That is taking place right now.

**Comment by schauveau** [comment]
I just switched from WiFi to RJ45. My test script has been running for about 20 minutes and does not show any missing or `Parse Error` responses after hundreds of UDP requests. 
I willreactivate the Marstek integration to see if that is enough to solve the problem.

**Comment by schauveau** [comment]
Switching to RJ45 did not help. The UDP connection was obviously a lot better but it failed after a few hours.

I will try modbus. The Venus 3 can do it on port 502. I already have a small python script that can successfully read some registers.

**Comment by ShodanOne** [comment]
I’m using this project for my own integration (Jeedom). I’m only using the api.py class in a similar way as it is done in test_tool.py.
In my integration, the polling sequence is different :
- every cycle : es.mode
- every 3 cycles : bat.status
- every 5 cycles : em. Status and pv.status (if applicable)
- every 10 cycles : es.status
I do not poll WiFi.status and ble.status, I just get it once at battery discovery.

My battery is a Venus E 3.0, on firmware 146.116.110, comm module is at 202506241541.
My CT is a Shelly pro 3EM, both the Shelly and battery are connected using WiFi.

I was facing a lot of battery crash too (loosing CT, going to manual & idle, disconnecting API).
After upgrading to this fw and an on/off of the battery, things seems better now. My plugin is working since 5 days in a row without any crash of the battery.

My polling period is currently 15sec, with a timeout of 3sec and 3 retry max.

EDIT : Battery just crashed after 6 days, and now keep crashing after a few time when polling through local api …

**Comment by notz** [comment]
Also happens to Venus A with FW Version 144.

Switching off for 4 Hours only helped for one day.

I don't know exactly when this issue was introduced. Either it was v144 or it is my script that is switching operation mode.

I use passive mode for charging, auto for discharge and in-between manual mode. 

Are you all using the passive mode for charging? Since it mostly happens over night, it may be related to that.

**Comment by schauveau** [comment]
I switched to https://github.com/fonske/MarstekVenusV3-modbus-TCP-IP. 

Everything works out of the box except for a small issue with some select entities for which I already have a solution (see my ticket https://github.com/fonske/MarstekVenusV3-modbus-TCP-IP/issues/6 )
 
I only tried it with RJ45 but since this is using TCP-IP I assume that it also works with WiFi. 

I might try the local api in a few month after they solve the bugs but so far that alternative using ModbusTCP  seems almost perfect.

**Comment by schauveau** [comment]
As a side note, I was upgraded from v144 to v146 soon after I switched from WiFi to RJ45. Not sure if that is related.

**Comment by bertsmelik** [comment]
My 2 Venus V3.0's were at firmware 146(-111?)  and I had 2 problems:

1. Batteries dropped "Local API" several times a day (batteries no longer visible in integration)
2. Auto (self initiated etc.) would not discharge
I reported this to Marstek support, who came up with a "solution": completely shutdown the batteries for 4 hours.
Although I was skeptical, I still went ahead (what can I loose?)

As advised by Marstek support I brought down both Venus V3.0's:

- disconnected from grid
- turned off battery
- waited 4 hours
- then reconnected and turned on
I found that all settings were still there. Only thing is that I had to put them in Discharging mode (using Passive, se below) again. Btw: Auto worked again after this!

Since that, both batteries are working without a problem for 24 hours now.

I am using Passive mode for charge and discharge. Built a loop in the corresponding scripts to check if the battery has indeed started charging ("Grid power" below 0) or discharging ("Grid power" above 0). That works well so far.

I will let you know how it went after these first 24 hours.

**Comment by bertsmelik** [comment]
> I switched to https://github.com/fonske/MarstekVenusV3-modbus-TCP-IP.
> 
> Everything works out of the box except for a small issue with some select entities for which I already have a solution (see my ticket [fonske/MarstekVenusV3-modbus-TCP-IP#6](https://github.com/fonske/MarstekVenusV3-modbus-TCP-IP/issues/6) )
> 
> I only tried it with RJ45 but since this is using TCP-IP I assume that it also works with WiFi.
> 
> I might try the local api in a few month after they solve the bugs but so far that alternative using ModbusTCP seems almost perfect.

Are you using the Marstek Local API directly or did you implement a modbus solution  also ?

**Comment by schauveau** [comment]
This is using modbus so no local api. The Venus3 provides modbus via TCP-IP on port 502 so it does not require any additional hardware.  
Really, it takes 2 minutes to install as explained in https://github.com/fonske/MarstekVenusV3-modbus-TCP-IP/blob/main/README.md

**Comment by schauveau** [comment]
if you use the provided MENU file, you should get a dashboard that looks more or less like that

<img width="1462" height="1186" alt="Image" src="https://github.com/user-attachments/assets/bc964152-87f4-4470-9ef8-0ca22485ead3" />

**Comment by bertsmelik** [comment]
Looks very interesting!
Before I start digging: how can I use Nord Pool pricing in here? I would like to control charge/discharge/idle based on prices (grossed up with taxes etc.).

**Comment by schauveau** [comment]
Well, the Work Mode select in the top right corner contains an `ai` option but you will have to configure the energy provider in the  Marstek app. I see that NordPool is in the list of supported energy providers so that should work.
 
There is just a small annoying. We know how to enable IA mode by writing 2 the modbus register 43000 but that register contains 1 when it is read again and that corresponds to `anti-feed` (i.e. autoconsomation with a CT).   In practice, that means that the select entity will incorrectly show `anti-feed`when IA mode is enabled. That can be verified in the Marstek app.   

There might be some modbus registers that contains relevant 'ia' information but they have not yet been identified.

**Comment by bertsmelik** [comment]
> if you use the provided MENU file, you should get a dashboard that looks more or less like that
> <img alt="Image" width="1462" height="1186" src="https://private-user-images.githubusercontent.com/14061306/535097486-bc964152-87f4-4470-9ef8-0ca22485ead3.png?jwt=eyJ0eXAiOiJKV1QiLCJhbGciOiJIUzI1NiJ9.eyJpc3MiOiJnaXRodWIuY29tIiwiYXVkIjoicmF3LmdpdGh1YnVzZXJjb250ZW50LmNvbSIsImtleSI6ImtleTUiLCJleHAiOjE3NjgzMzA1MDIsIm5iZiI6MTc2ODMzMDIwMiwicGF0aCI6Ii8xNDA2MTMwNi81MzUwOTc0ODYtYmM5NjQxNTItODdmNC00NDcwLTllZjgtMGNhMjI0ODVlYWQzLnBuZz9YLUFtei1BbGdvcml0aG09QVdTNC1ITUFDLVNIQTI1NiZYLUFtei1DcmVkZW50aWFsPUFLSUFWQ09EWUxTQTUzUFFLNFpBJTJGMjAyNjAxMTMlMkZ1cy1lYXN0LTElMkZzMyUyRmF3czRfcmVxdWVzdCZYLUFtei1EYXRlPTIwMjYwMTEzVDE4NTAwMlomWC1BbXotRXhwaXJlcz0zMDAmWC1BbXotU2lnbmF0dXJlPWVkOTA1N2Y5NjdmOGVhNTc4YjNhNmU2YjBmNTZmZWVkMWUwZTVmNGM0ZGRhZDYxNTg1NmE0Y2MzOGY5ZWY4M2ImWC1BbXotU2lnbmVkSGVhZGVycz1ob3N0In0.AHhLrAvz5oeijUkgZxMMuKm3rlqAeNn6LNUNfV8_TUI">

I have installed the Fonske stuff and it seems to work.
However: missing the P1 power. I have no clue where to find that! Could you please give some guidance? I have 3-phase grid connection.

**Comment by schauveau** [comment]
P1 power is not provided by the battery. This is the grid power measured by your own energy meter (if you have one). you need to edit the entity in the gauge.

**Comment by dennisbest85-coder** [comment]
> I switched to https://github.com/fonske/MarstekVenusV3-modbus-TCP-IP.
> 
> Everything works out of the box except for a small issue with some select entities for which I already have a solution (see my ticket [fonske/MarstekVenusV3-modbus-TCP-IP#6](https://github.com/fonske/MarstekVenusV3-modbus-TCP-IP/issues/6) )
> 
> I only tried it with RJ45 but since this is using TCP-IP I assume that it also works with WiFi.
> 
> I might try the local api in a few month after they solve the bugs but so far that alternative using ModbusTCP seems almost perfect.

The Modbus over TCP feature looks very promising! I just added it, but in my setup it’s running over WiFi. Is it correct that Modbus only works over RJ45 (wired Ethernet)?

Does anyone have experience using Modbus over TCP via WiFi?
Also, in my case it isn’t retrieving any data from the Marstek batteries, is this expected or am I missing something?

**Comment by schauveau** [comment]
I checked with my modbus python test script and it seems that the modpus port is not availble via WiFi.

**Comment by bertsmelik** [comment]
> P1 power is not provided by the battery. This is the grid power measured by your own energy meter (if you have one). you need to edit the entity in the gauge.

Thanks for taking the time. Stupid me: I created a helper to subtract he grid output from the grid input from the DSMR integration. Solved.

**Comment by bertsmelik** [comment]
> I checked with my modbus python test script and it seems that the modpus port is not availble via WiFi.

By the way: the Fonske stuff runs over WiFi here.

**Comment by schauveau** [comment]
That's odd. 

I already knew that only one modbus connection can be active so I have to disable  modbus in HomeAssistant (with the action `modbus.stop`) in order to run my script.  It could be that the battery only allows the first network interface on which the port 502 is used.

Or that could be firmware related. I am using using 146.

**Comment by schauveau** [comment]
That is very odd! I turned off my Venus and I can still ping the Venus on both WiFi and RJ45 while it is OFF. It is not fully off. This is probably why Marstek is asking people to turn it OFF for 4 hours when there is a problem.  

Anyways, after turning it ON, I still cannot access modbus on WiFi. I may have to wait for the full 4 hours to see if that has an effect.  

And of course, most of my settings are gone. This is annoying !!!!

**Comment by ShodanOne** [comment]
@schauveau same here, no modbus over Wifi, but OK over RJ45. I'm on FW 146 too.
@bertsmelik can you explain what is your configuration to have modbus working over Wifi ?
Thanks

**Comment by bertsmelik** [comment]
> [@schauveau](https://github.com/schauveau) same here, no modbus over Wifi, but OK over RJ45. I'm on FW 146 too. [@bertsmelik](https://github.com/bertsmelik) can you explain what is your configuration to have modbus working over Wifi ? Thanks

Nothing special. My 2 x Venus 3.0's are connected with RJ45 and WiFi. I have experienced that they do not use RJ45 but stick to WiFi. I understand that there is a procedure to convince them to use RJ45 instead. You may have done that to run over RJ45. Maybe you could do the inversion of that procedure?

**Comment by schauveau** [comment]
> Nothing special. My 2 x Venus 3.0's are connected with RJ45 and WiFi. I have experienced that they do not use RJ45 but stick to WiFi. I understand that there is a procedure to convince them to use RJ45 instead. You may have done that to run over RJ45. Maybe you could do the inversion of that procedure?

Yeah. I will turn it off tonight for several hours to see if this is enough to bring back modbus via WiFi. I will also fill a ticket in  fonske repository because this is probably a better place than here to discuss that problem.

**Comment by schauveau** [comment]
Please continue the discussion here for ModbusTCP via WiFi : https://github.com/fonske/MarstekVenusV3-modbus-TCP-IP/discussions/10

**Comment by schauveau** [comment]
@bertsmelik 
> Nothing special. My 2 x Venus 3.0's are connected with RJ45 and WiFi. I have experienced that they do not use RJ45 but stick to WiFi. I understand that there is a procedure to convince them to use RJ45 instead. You may have done that to run over RJ45. Maybe you could do the inversion of that procedure?

That's odd! What do you mean by "I have experienced that they do not use RJ45" ? Are you saying that your RJ45 connection is broken?  Are you sure that you are not confusing the RJ45 and WiFi ip addresses?

**Comment by bertsmelik** [comment]
> [@bertsmelik](https://github.com/bertsmelik)
> 
> > Nothing special. My 2 x Venus 3.0's are connected with RJ45 and WiFi. I have experienced that they do not use RJ45 but stick to WiFi. I understand that there is a procedure to convince them to use RJ45 instead. You may have done that to run over RJ45. Maybe you could do the inversion of that procedure?
> 
> That's odd! What do you mean by "I have experienced that they do not use RJ45" ? Are you saying that your RJ45 connection is broken? Are you sure that you are not confusing the RJ45 and WiFi ip addresses?

No it's not broken. There are 2 IP addresses for each battery: one for the WiFi and one for RJ45. Both are visible and respond to ping.

**Comment by notz** [comment]
After support reverted the firmware of my Venus A from 144 to 143, the issue didn't occur since then (6+ days). Before I had this issue nearly every day.

**Comment by CelticParc** [comment]
Venus E 2.0 - V146: For several days now, the setting to use the local API has been regularly set to inactive in my Mastek app.
I wonder if this is a Mastek problem or if it is somehow related to the API itself?

Does someone has a solution or possible fix for this?

**Comment by Member0815** [comment]
Venus E 3.0 startet with firmware V144 2 weeks ago, now V147 since 1 week. Venus uses Wlan only with an Ecotracker, but bad connection of -60dB.. -70dB. But working without any problems in "Eigenverbrauch" mode. The only problem so far is, that API does not work correctly. I'm polling ES.GetStatus every 30s and getting a correct answer in roundabout 50%. The other are "no answer" or "parse error" or wrong JSON-structures. Concerning API no changes from V144 to V147. So hoping for future improvements

**Comment by xlouk** [comment]
> if you use the provided MENU file, you should get a dashboard that looks more or less like that
> <img alt="Image" width="1462" height="1186" src="https://private-user-images.githubusercontent.com/14061306/535097486-bc964152-87f4-4470-9ef8-0ca22485ead3.png?jwt=eyJ0eXAiOiJKV1QiLCJhbGciOiJIUzI1NiJ9.eyJpc3MiOiJnaXRodWIuY29tIiwiYXVkIjoicmF3LmdpdGh1YnVzZXJjb250ZW50LmNvbSIsImtleSI6ImtleTUiLCJleHAiOjE3NzIwNTgyNjgsIm5iZiI6MTc3MjA1Nzk2OCwicGF0aCI6Ii8xNDA2MTMwNi81MzUwOTc0ODYtYmM5NjQxNTItODdmNC00NDcwLTllZjgtMGNhMjI0ODVlYWQzLnBuZz9YLUFtei1BbGdvcml0aG09QVdTNC1ITUFDLVNIQTI1NiZYLUFtei1DcmVkZW50aWFsPUFLSUFWQ09EWUxTQTUzUFFLNFpBJTJGMjAyNjAyMjUlMkZ1cy1lYXN0LTElMkZzMyUyRmF3czRfcmVxdWVzdCZYLUFtei1EYXRlPTIwMjYwMjI1VDIyMTkyOFomWC1BbXotRXhwaXJlcz0zMDAmWC1BbXotU2lnbmF0dXJlPWFkYjZkNjYzOTU0M2UyNThkMTdmYTIyNzAzNTkyZTU2ZjUxOTg2ZWIyNzNiOGVkZmEwYmQ4MmIwZmVkMDMwODMmWC1BbXotU2lnbmVkSGVhZGVycz1ob3N0In0.mo1uMjvVKm1KnIixfhj6Jqg1E3Auvz3O_6HMcvqEtWc">

Thanks for showing up this. It works quite well. For the latest HA version: 2026.2.3, I had to make some adaption to get it to work and I fixed some labels in language NL to EN. The docu didn't mention to adapt the sensore for the Grid power (2 references P1 ..). Since I use IOMeter, I used the sensor for Grid Power. The path to integrate, changed also a bit in the latest HA (add in Settings\Dashboard a dashboard, enter it from the left menu, click on pencil, then 3 dots and select Raw-configuration editor, paste the MENU code, adapt in my case the two sensor.iometer_1isk0078405026_leistung to yours and save and click done. Thats it. Adding to configuration.yaml file:

```
homeassistant:
  packages: !include_dir_named packages
```

and coping the "marstek_m3_modbus_tcp.yaml" for Venus E3.0 to the folder => /config/packages remains as decribed in the docu.

That is how the MENU yaml looks like for HA version: 2026.2.3:

```
views:
  - type: masonry
    path: mt3
    title: Marstek M3
    icon: mdi:battery-charging-60
    cards:
      - type: vertical-stack
        cards:
          - type: horizontal-stack
            cards:
              - type: gauge
                entity: sensor.iometer_1isk0078405026_leistung
                name: Grid Power Meter
                needle: true
                max: 6000
                severity:
                  green: -6000
                  yellow: 0
                  red: 0
                min: -6000
              - type: gauge
                entity: sensor.marstek_m3_ac_power
                name: Battery Power
                needle: true
                max: 2500
                severity:
                  green: -2500
                  yellow: 0
                  red: 0
                min: -2500
              - type: gauge
                entity: sensor.marstek_m3_battery_state_of_charge
                name: Battery SOC
                needle: true
                max: 100
                severity:
                  green: 66
                  yellow: 33
                  red: 0
                min: 0
          - type: entities
            entities:
              - entity: sensor.marstek_m3_battery_remaining_capacity
                name: Battery remaining
              - entity: sensor.marstek_m3_internal_temperature
                name: Internal temperature
          - type: history-graph
            hours_to_show: 12
            entities:
              - entity: sensor.iometer_1isk0078405026_leistung
                name: Grid Power Meter
          - type: custom:apexcharts-card
            experimental:
              color_threshold: true
            cache: false
            stacked: true
            header:
              show: true
              show_states: true
            graph_span: 1d
            series:
              - entity: sensor.marstek_m3_battery_state_of_charge
                name: SOC
                type: line
                color: '#ffg'
                stroke_width: 2
                extend_to: false
                curve: straight
                group_by:
                  func: min
                  duration: 15min
                show:
                  in_header: false
              - entity: sensor.marstek_m3_ac_power
                name: M3 Battery
                group_by:
                  func: avg
                  duration: 15min
                type: column
                yaxis_id: energy
                show:
                  in_header: false
                float_precision: 0
                color: '#8f05e4'
                color_threshold:
                  - value: 0
                    opacity: 1
                    color: '#6700a7'
                  - value: -1
                    opacity: 1
                    color: '#46a635'
              - entity: sensor.marstek_m3_daily_charging_energy
                yaxis_id: header_only
                name: Today charged
                show:
                  in_header: true
                  in_chart: false
              - entity: sensor.marstek_m3_daily_discharging_energy
                yaxis_id: header_only
                name: Today discharged
                show:
                  in_header: true
                  in_chart: false
              - entity: sensor.marstek_m3_battery_state_of_charge
                yaxis_id: header_only
                name: Battery SOC
                show:
                  in_header: true
                  in_chart: false
            span:
              start: day
            apex_config:
              stroke:
                show: true
                dashArray: 0
              tooltip:
                x:
                  format: HH:mm
                  show: false
              xaxis:
                labels:
                  show: false
                  style:
                    colors: grey
                axisTicks:
                  show: false
                axisBorder:
                  color: '#616269'
              yaxis:
                - title:
                    text: ''
                  decimalsInFloat: 0
                  min: 0
                  max: 100
                  tickAmount: 6
                  opposite: true
                  labels:
                    show: false
                    style:
                      colors: '#7b7c83'
                - title:
                    text: ''
                  decimalsInFloat: 0
                  min: -2500
                  max: 2500
                  tickAmount: 10
                  labels:
                    style:
                      colors: '#616269'
              grid:
                strokeDashArray: 0
                borderColor: '#343434'
                show: true
              chart:
                height: 210px
              legend:
                show: false
          - type: custom:apexcharts-card
            header:
              title: My Battery Status - Last 7 Days
              show: true
            graph_span: 7d
            yaxis:
              - id: first
                min: 0
                max: 6
                decimals: 0
                apex_config:
                  tickAmount: 6
              - id: second
                min: 0
                max: 100
                opposite: true
                decimals: 0
                apex_config:
                  tickAmount: 10
            span:
              start: day
              offset: '-6d'
            series:
              - entity: sensor.marstek_m3_daily_charging_energy
                name: Charged (kWh)
                type: column
                color: '#FF4500'
                group_by:
                  func: last
                  duration: 1d
                show:
                  in_header: true
                  legend_value: true
                yaxis_id: first
              - entity: sensor.marstek_m3_daily_discharging_energy
                name: Discharged (kWh)
                type: column
                color: '#CCD500'
                group_by:
                  func: last
                  duration: 1d
                show:
                  in_header: true
                  legend_value: true
                yaxis_id: first
            apex_config:
              xaxis:
                title:
                  text: Datum
                type: datetime
              plotOptions:
                bar:
                  horizontal: false
              dataLabels:
                enabled: false
              stroke:
                show: true
                width: 2
              tooltip:
                enabled: true
                shared: true
              grid:
                show: true
      - type: entities
        entities:
          - entity: sensor.marstek_m3_inverter_state
            name: Inverter State
          - entity: sensor.marstek_m3_ac_power
            name: AC Power
          - entity: sensor.marstek_m3_ac_voltage
            name: AC Voltage
          - entity: sensor.marstek_m3_battery_charge_current_limit
            name: Battery Charge Current Limit
          - entity: sensor.marstek_m3_battery_charge_voltage_limit
            name: Battery Charge Voltage Limit
          - entity: sensor.marstek_m3_battery_discharge_current_limit
            name: Battery Discharge Current Limit
          - entity: sensor.marstek_m3_battery_power
            name: Battery Power
          - entity: sensor.marstek_m3_battery_remaining_capacity
            name: Battery Remaining Capacity
          - entity: sensor.marstek_m3_battery_state_of_charge
            name: Battery State Of Charge
          - entity: sensor.marstek_m3_battery_total_energy
            name: Battery Total Energy
          - entity: sensor.marstek_m3_internal_mos1_temperature
            name: Internal MOS1 Temperature
          - entity: sensor.marstek_m3_internal_mos2_temperature
            name: Internal MOS2 Temperature
          - entity: sensor.marstek_m3_internal_temperature
            name: Internal Temperature
          - entity: sensor.marstek_m3_max_cell_temperature
            name: Max. Cell Temperature
          - entity: sensor.marstek_m3_min_cell_temperature
            name: Min. Cell Temperature
          - entity: sensor.marstek_m3_daily_charging_energy
            name: Daily Charging Energy
          - entity: sensor.marstek_m3_daily_discharging_energy
            name: Daily Discharging Energy
          - entity: sensor.marstek_m3_monthly_charging_energy
            name: Monthly Charging Energy
          - entity: sensor.marstek_m3_monthly_discharging_energy
            name: Monthly Discharging Energy
          - entity: sensor.marstek_m3_monthly_round_trip_efficiency
            name: Monthly Round Trip Efficiency
          - entity: sensor.marstek_m3_lifetime_charging_energy
            name: Lifetime Charging Energy
          - entity: sensor.marstek_m3_lifetime_discharging_energy
            name: Lifetime Discharging Energy
          - entity: sensor.marstek_m3_lifetime_round_trip_efficiency
            name: Lifetime Round Trip Efficiency
          - entity: sensor.marstek_m3_battery_cell_1_voltage
            name: Battery Cell 1 Voltage
          - entity: sensor.marstek_m3_battery_cell_2_voltage
            name: Battery Cell 2 Voltage
          - entity: sensor.marstek_m3_battery_cell_3_voltage
            name: Battery Cell 3 Voltage
          - entity: sensor.marstek_m3_battery_cell_4_voltage
            name: Battery Cell 4 Voltage
          - entity: sensor.marstek_m3_battery_cell_5_voltage
            name: Battery Cell 5 Voltage
          - entity: sensor.marstek_m3_battery_cell_6_voltage
            name: Battery Cell 6 Voltage
          - entity: sensor.marstek_m3_battery_cell_7_voltage
            name: Battery Cell 7 Voltage
          - entity: sensor.marstek_m3_battery_cell_8_voltage
            name: Battery Cell 8 Voltage
          - entity: sensor.marstek_m3_battery_cell_9_voltage
            name: Battery Cell 9 Voltage
          - entity: sensor.marstek_m3_battery_cell_10_voltage
            name: Battery Cell 10 Voltage
          - entity: sensor.marstek_m3_battery_cell_11_voltage
            name: Battery Cell 11 Voltage
          - entity: sensor.marstek_m3_battery_cell_12_voltage
            name: Battery Cell 12 Voltage
          - entity: sensor.marstek_m3_battery_cell_13_voltage
            name: Battery Cell 13 Voltage
          - entity: sensor.marstek_m3_battery_cell_14_voltage
            name: Battery Cell 14 Voltage
          - entity: sensor.marstek_m3_battery_cell_15_voltage
            name: Battery Cell 15 Voltage
          - entity: sensor.marstek_m3_battery_cell_16_voltage
            name: Battery Cell 16 Voltage
        title: MT3
      - type: entities
        entities:
          - entity: select.marstek_m3_rs485_control_mode
            name: RS485 Control Mode
          - entity: select.marstek_m3_user_work_mode
            name: User Work Mode
          - entity: select.marstek_m3_forcible_charge_discharge
            name: Forcible Charge/Discharge
          - entity: number.marstek_m3_forcible_discharge_power
            name: Forcible Discharge Power
          - entity: number.marstek_m3_forcible_charge_power
            name: Forcible Charge Power
          - entity: number.marstek_m3_max_charge_power
            name: Max. Charge Power
          - entity: number.marstek_m3_max_discharge_power
            name: Max. Discharge Power
          - entity: select.marstek_m3_backup_function
            name: Backup Function
          - entity: number.marstek_m3_charge_to_soc
            name: Charge To SOC
        title: MT3
      - type: entities
        entities:
          - entity: sensor.marstek_m3_device_name
            name: Device Name
          - entity: sensor.marstek_m3_battery_wifi_signal_strength
            name: Battery WiFi Signal Strength
          - entity: sensor.marstek_m3_wifi_state
            name: Wifi state
          - entity: sensor.marstek_m3_bt_state
            name: BT state
          - entity: sensor.marstek_m3_cloud_state
            name: Cloud state
          - entity: sensor.marstek_m3_ems_version
            name: EMS version
          - entity: sensor.marstek_m3_vns_version
            name: VNS version
          - entity: sensor.marstek_m3_bms_version
            name: BMS Version
          - entity: sensor.marstek_m3_com_module_version
            name: COM module version
          - entity: sensor.marstek_m3_mac
            name: MAC
        title: MT3
```

**Comment by floppymonster** [comment]
venus 3 V147 same issue, 
My battery keeps going to manual mode, dod goign back to 88% and local api turning off. (I then turn everything back and the battery reverts to these settings within 24 hours.....)

I tried turning by battery off and disconnected it for 24 hours, no succes
i tried setting the request from 60 to 120 seconds, no succes ( Used https://github.com/jaapp/ha-marstek-local-api/pull/97 for easy changing of the setting via the gui)
Figured i could try the extra delay in bearhatcode his pull request, but no success, (used https://github.com/jaapp/ha-marstek-local-api/pull/54 )

Only thing that works is turning off local API..... But cmon i want that data.... 

dont have acces to lan cable near my battery, gues i will be using a wifi mesh device to pickup the wifi and use that to connect the battery via RJ45, that probably wont do anything, but then i will try the modbus solution......

**Comment by weibell** [comment]
As I've stated in #75, I've observed the resetting issue with v146, v147, and with v147.2. The frequency seems to have gotten worse, now it resets the grid power, DoD and CT settings within 30 minutes :(

After turning the local API setting off, I don't experience this issue anymore.

**Comment by Firepaul1** [comment]
I've managed to get it pretty stable by playing around with some timers. For me, the local API turned off about every 4 hours. In the last 3 days, this only happened once. These timers are not perfect , but they work for me. I will keep changing them, until it doesn't reset anymore. The downside is: the entity "Battery Power" is no longer available with these timers. But, in my case, grid power shows the same data and is still available.

I changed the timers in const.py to following:

# Default values
DEFAULT_PORT: Final = 30000
DEFAULT_SCAN_INTERVAL: Final = 120  # Base interval in seconds - def: 60
DISCOVERY_TIMEOUT: Final = 9  # Discovery window in seconds - def: 9
DISCOVERY_BROADCAST_INTERVAL: Final = 2  # Broadcast every 2 seconds during discovery - def: 2

# Update intervals (in multiples of base interval)
UPDATE_INTERVAL_FAST: Final = 1  # ES, Battery status (60s) - def: 1
UPDATE_INTERVAL_MEDIUM: Final = 5  # EM, PV, Mode (300s) - def: 5
UPDATE_INTERVAL_SLOW: Final = 15  # Device, WiFi, BLE (600s) - def: 15

# Communication timeouts
COMMAND_TIMEOUT: Final = 30  # Timeout for commands in seconds - def: 15
MAX_RETRIES: Final = 6  # Maximum retries for critical commands - def: 3
RETRY_DELAY: Final = 5  # Delay between retries in seconds - def: 2
COMMAND_MAX_ATTEMPTS: Final = 6  # Attempts per command before giving up - def: 3
COMMAND_BACKOFF_BASE: Final = 1.5  # Base delay for command retry backoff
COMMAND_BACKOFF_FACTOR: Final = 2.0  # Multiplier for successive backoff delays
COMMAND_BACKOFF_MAX: Final = 12.0  # Upper bound on backoff delay
COMMAND_BACKOFF_JITTER: Final = 0.4  # Additional random jitter for backoff
UNAVAILABLE_THRESHOLD: Final = 600  # Seconds before marking device unavailable - def: 120

I will change the timers "MAX_RETRIES:" and "COMMAND_MAX_ATTEMPTS:" to 8. I think, that when HA doesn't get an answer from the API, within the X tries, HA marks it as unavailable and this might "kill" the API. (just a wild guess)

**Comment by zod1986** [comment]
Bonjour,
J'ai résolu le problème de plantage de la batterie et le délai de communication en ne connectant PAS la pince Ampermétrique sur l'intégration Marstek et en utilisant le mode PASSIF uniquement avec home assistant et une automatisation et divers reglages ( heures creuses, reglages de seuils) directement depuis un fichier Packages. Mon delai d’interrogation est de 15 secondes tout le temps et sans faire planter la batterie !

<img width="990" height="849" alt="Image" src="https://github.com/user-attachments/assets/69c2e9ab-c641-4480-a344-4a505907c226" />

**Comment by rob-vriens** [comment]
Hi @Firepaul1 ,
I saw you changed the timers in const.py, very interesting.
My devices are 2x Venus E 2.0 v158, but before I want to try, can you share what Marstek device you are using?

Some local API communication observation from my side:
At first, I had both devices on UDP port 30000, but that caused many constant communication issues with both batteries. After having set one battery to port 30001, the communication was suddenly much smoother, though not perfect yet.

**Comment by Firepaul1** [comment]
Hi @rob-vriens 
I have a Venues E3 V147. But now I run V148. That's even worse and made the API not even turn on anymore... Anyways.
Changing the port should not change the stability of the API or the battery itself. From Network perspective, the ports are identical. The packet size or anything else does not change, when changing the port. It's simply an identifier. I already tried different ports. That didn't change anything. In a different thread I also read, that too many requests to the API may trigger a buffer overflow and therefore, at least in my case, perform a complete factory reset. Including losing the ct, turing api off, resetting led and dod. If that is correct, then changing these timers might solve/ help with this issue. If I turn off the API, the battery did not loose connection to the CT. So the idea of a buffer overflow sounds plausible to me. 
The software behind this is simply not ready yet. Without the Smart Home stuff this battery works perfectly fine.

**Comment by floppymonster** [comment]
I have fully switched to modbus TCP. 

The API gave so much problems regardless of what I did. 

Even bought a small box to convert wifi back to Ethernet. Plugged in the battery. But still the same issues persisted. It would work for a Max of 48 hours but then the battery would stop, lose it settings and go to manual mode. 

But since I was wired now, I could use modbus TCP. And have not had a single issue since I switched over.

**Comment by Firepaul1** [comment]
Since I don't have a life I decided to analyze the network traffic between Home Assistant and the Battery. Maybe this helps someone.

Setup:
Home Assistant server: 192.168.178.118
Battery (Marstek): 192.168.178.116 (connected via WiFi)
Access Point: 192.168.178.122
Signal strength: ~ -53 dBm (stable/good)
Communication: Local API via UDP port 30000

The battery is continuously reachable via ICMP (ping) from other devices.
Home Assistant intermittently loses communication with the battery’s local API. This results in gaps in data updates and failed polling cycles.

A packet capture between the Home Assistant server and the battery shows the following repeating pattern:

1. Short UDP exchange
- HA sends a request to the battery (UDP/30000)
- Battery responds correctly
- Typically 2–4 request/response packets
2. Communication stops
- No further UDP responses from the battery
3. ARP activity begins
- HA sends ARP requests → battery responds
- Shortly after, the access point (192.168.178.122) repeatedly sends ARP requests
- These ARP requests from the AP often go unanswered
4. Recovery
- After ~60 seconds, the battery responds again
- UDP communication resumes briefly
- Cycle repeats

The issue correlates with periods where:
The battery does not respond to ARP requests consistently
The access point repeatedly tries to resolve the battery’s MAC address
This suggests the problem is not related to UDP itself, but rather intermittent reachability at layer 2 (ARP)

My Guess:
WiFi power-saving or sleep behavior of the battery causes it to stop responding on layer 2 to ARP Requests. Therefore the Access Point and Home Assistant don't know where to reach the battery causing these interruptions 

10:08:13.367755 IP 192.168.178.118.30000 > 192.168.178.116.30000: UDP, length 58
10:08:13.466828 IP 192.168.178.116.30000 > 192.168.178.118.30000: UDP, length 293
10:08:14.469463 IP 192.168.178.118.30000 > 192.168.178.116.30000: UDP, length 59
10:08:14.589472 IP 192.168.178.116.30000 > 192.168.178.118.30000: UDP, length 209
10:08:18.545354 ARP, Request who-has 192.168.178.116 tell 192.168.178.118, length 28
10:08:18.550302 ARP, Reply 192.168.178.116 is-at xx:xx:xx:xx:xx:xx, length 46
10:08:23.141267 ARP, Request who-has 192.168.178.116 tell 192.168.178.122, length 46
10:08:35.141727 ARP, Request who-has 192.168.178.116 tell 192.168.178.122, length 46
10:08:47.141458 ARP, Request who-has 192.168.178.116 tell 192.168.178.122, length 46
10:08:59.140960 ARP, Request who-has 192.168.178.116 tell 192.168.178.122, length 46
10:09:00.141122 ARP, Request who-has 192.168.178.116 tell 192.168.178.122, length 46
10:09:12.141785 ARP, Request who-has 192.168.178.116 tell 192.168.178.122, length 46
10:09:15.367261 IP 192.168.178.118.30000 > 192.168.178.116.30000: UDP, length 58
10:09:15.454265 IP 192.168.178.116.30000 > 192.168.178.118.30000: UDP, length 297
10:09:16.456821 IP 192.168.178.118.30000 > 192.168.178.116.30000: UDP, length 59
10:09:16.575960 IP 192.168.178.116.30000 > 192.168.178.118.30000: UDP, length 209

**Comment by schauveau** [comment]
Interesting.  I am not familiar with ARP but in your logs, I noticed that the first ARP who-has request has a length 28 while unanswered ones have length 46 exactly like the ARP reply.  Could that be that the unanswered requests are simply the AP acknowledging the answer? That would make sense because the first unanswered request comes only 5 seconds after the reply which seems a very short delay for invalidating a network cache entry.         

Anyways, if that is really an ARP problem then could that be solved by manipulating the ARP cache on the server running HA or on the WiFi AP ?

According to the arp man page, you can write a permanent entry in the arp cache with something like that:
```
sudo arp -s 192.168.178.116 xx:xx:xx:xx:xx:xx
```

**Comment by Firepaul1** [comment]
I am not sure why one packet is 28 bytes and the other ones have 46 bytes. Regarding to AI it's just Ethernet padding and both are vaild ARP requests. But ARP does not use acknowledges like TCP. ARP only uses Request and Reply. We see that in the packet capture.
Creating a permanent entry in the ARP cache does sadly not solve this issue, since this is no cache expiration. I checked it on my HA Server:

root@HomeAssistant:/home/paul/media/homeassistant/config/custom_components/marstek_local_api# ip neigh show 192.168.178.116 192.168.178.116 dev enp1s0 lladdr xx:xx:xx:xx:xx:xx REACHABLE root@HomeAssistant:/home/paul/media/homeassistant/config/custom_components/marstek_local_api# ip neigh show 192.168.178.116 192.168.178.116 dev enp1s0 lladdr xx:xx:xx:xx:xx:xx DELAY root@HomeAssistant:/home/paul/media/homeassistant/config/custom_components/marstek_local_api# ip neigh show 192.168.178.116 192.168.178.116 dev enp1s0 lladdr xx:xx:xx:xx:xx:xx DELAY root@HomeAssistant:/home/paul/media/homeassistant/config/custom_components/marstek_local_api# ip neigh show 192.168.178.116 192.168.178.116 dev enp1s0 lladdr xx:xx:xx:xx:xx:xx DELAY root@HomeAssistant:/home/paul/media/homeassistant/config/custom_components/marstek_local_api# ip neigh show 192.168.178.116 192.168.178.116 dev enp1s0 lladdr xx:xx:xx:xx:xx:xx DELAY root@HomeAssistant:/home/paul/media/homeassistant/config/custom_components/marstek_local_api# ip neigh show 192.168.178.116 192.168.178.116 dev enp1s0 lladdr xx:xx:xx:xx:xx:xx DELAY root@HomeAssistant:/home/paul/media/homeassistant/config/custom_components/marstek_local_api# ip neigh show 192.168.178.116 192.168.178.116 dev enp1s0 lladdr xx:xx:xx:xx:xx:xx DELAY root@HomeAssistant:/home/paul/media/homeassistant/config/custom_components/marstek_local_api# ip neigh show 192.168.178.116 192.168.178.116 dev enp1s0 lladdr xx:xx:xx:xx:xx:xx REACHABLE

REACHABLE → everything fine
DELAY → “haven’t heard back, let’s verify soon”
(then ARP happens)
REACHABLE again → once battery responds

I also checked the ARP cache when this issue occured (no static entry). It did not get erased/ cleared. The ARP entry for the battery was still there. Nevertheless I still created a static ARP entry. Maybe I'm wrong.

I think the real problem is that the battery stops responding. And because of that, the ARP request from HA gets triggered. 
It's not an ARP Problem on the HA server or the Wifi AP. ARP is simply the symptom of the problem.

**Comment by schauveau** [comment]
Could you prevent the WiFi from entering power-saving mode by pinging the battery every few seconds? 

Anyways, I do not see how network issues like that could cause a reboot and a reset of some configuration items.  There must be a more severe bug in the firmware, probably a memory leak or a memory corruption.

**Comment by floppymonster** [comment]
And the same issue happens when the battery is connected via LAN instead of wifi...... So it cant (only)  be caused by the wifi module.

**Comment by schauveau** [comment]
This is probably a known information but TCP port 8091 provides some logs for the Local Api.

Here is a typical output for a `ES.GetStatus` request

```
# nc venus.private 8091

************** [Recv info] interact_type: 2, id: 1, id_info: , method(6): ES.GetStatus.

Send Json:{Es data} len:(298), data: 
{
	"id":	1,
	144534,
		"total_grid_input_energy":	194759,
		"total_load_energy":	0
	}
}
```

I stopped using the Local Api a long time ago but if I remember well, a lot of WiFi UDP requests failed because the message was truncated messages. That problem pretty much disappeared after switching to LAN but that was not not enough to prevent the Local Api crash. My advice is to switch to Modbus. This is limited to LAN but it is rock solid.

**Comment by schauveau** [comment]
In my previous comment, a significant part of the JSON response on port 8091 is obviously missing. I do not know if this is another symptom or simply a bad copy-paste by me.

... definitely an copy-paste problem. A good output looks like that 

```
************** [Recv info] interact_type: 2, id: 1, id_info: , method(6): ES.GetStatus.

Send Json:{Es data} len:(298), data: 
{
	"id":	1,
	"src":	"VenusE 3.0-bc2a33601ff9",
	"result":	{
		"id":	0,
		"bat_soc":	59,
		"bat_cap":	5120,
		"pv_power":	0,
		"ongrid_power":	-328,
		"offgrid_power":	0,
		"total_pv_energy":	0,
		"total_grid_output_energy":	144534,
		"total_grid_input_energy":	194835,
		"total_load_energy":	0
	}
}
```

**Comment by Firepaul1** [comment]
"Could you prevent the WiFi from entering power-saving mode by pinging the battery every few seconds?"
- I did. But this didn't help. But I did see spikes in latency when pinging. I also use a shelly as a CT. In the Shelly logs I can see that, the battery is still communicating with the shelly via UDP Broadcast on port 1010, while the communication with the HA Server is interrupted. But that can be explained because for Broadcast there is no ARP request needed. Just a flooding to the network. The communication to HA is via Unicast UDP. It looks like the battery has difficulties receiving packets but not sending them out.

"Anyways, I do not see how network issues like that could cause a reboot and a reset of some configuration items. There must be a more severe bug in the firmware, probably a memory leak or a memory corruption."
- Yes that's true. Instable network should not cause a factory reset of the battery/ settings. We're basically doing a denial of service of our battery with this. 

I also switched to LAN to test it. Same issue here as I mentioned with wifi. I performed a packet capture aswell. Exactly the same behaviour as with Wifi. 
But I still believe, that if the polling timers from HA gets adjusted to the correct numbers, it should be quite stable. Slow but stable.
When we don't ask for information that often, the Battery should be able to handle it without crashing. I'm just going to double every timer to test if that's more stable.
